<?xml version="1.0" encoding="UTF-8"?>
<xs:schema xmlns:xs="http://www.w3.org/2001/XMLSchema" elementFormDefault="qualified">
  <xs:element name="messages">
    <xs:complexType>
      <xs:sequence>
        <xs:element maxOccurs="unbounded" ref="message"/>
        <xs:element ref="informationsMessages"/>
      </xs:sequence>
    </xs:complexType>
  </xs:element>
  <xs:element name="message">
    <xs:complexType>
      <xs:sequence>
        <xs:element ref="auteur"/>
        <xs:element ref="date"/>
        <xs:element ref="contenu"/>
      </xs:sequence>
      <xs:attribute name="reference" use="required" type="xs:integer"/>
    </xs:complexType>
  </xs:element>
  <xs:element name="auteur" type="xs:NCName"/>
  <xs:element name="date" type="xs:NMTOKEN"/>
  <xs:element name="contenu" type="xs:string"/>
  <xs:element name="informationsMessages">
    <xs:complexType>
      <xs:sequence>
        <xs:element ref="nombreMessages"/>
        <xs:element ref="datePremierMessage"/>
      </xs:sequence>
    </xs:complexType>
  </xs:element>
  <xs:element name="nombreMessages" type="xs:integer"/>
  <xs:element name="datePremierMessage" type="xs:NMTOKEN"/>
</xs:schema>
